source_id,source_type,source_name,database_or_url,used_for,license_status,redistribution_status,public_artifact,notes
SRC-OBJ-001,question_bank,objective carbon-neutrality questions,not_applicable_or_mixed_sources,objective_evaluation,third_party_or_mixed,summarized_and_public_evaluation_file,data/objective_questions.xlsx,"The public file contains 700 multiple-choice questions, reference answers, model outputs, and correctness labels. Source-specific redistribution rights should be verified before reuse beyond academic review."
SRC-SUBJ-001,question_bank,open-ended carbon-neutrality questions,not_applicable_or_mixed_sources,subjective_evaluation,third_party_or_mixed,summarized_and_public_evaluation_file,data/subjective_questions.xlsx,"The public file contains 249 open-ended questions, reference answers, model responses, automatic metrics, keyword coverage, and judge scores. Source-specific redistribution rights should be verified before reuse beyond academic review."
SRC-LIT-001,literature_corpus,carbon-neutrality research literature,CNKI_and_Web_of_Science,retrieval_corpus,restricted_database_or_publisher_license,metadata_and_processing_scripts_only,data/README.md,"Full-text documents are not redistributed because database and publisher licenses may restrict sharing."
SRC-WIKI-001,encyclopedic_corpus,carbon-neutrality-related Wikipedia pages,wikipedia.org,supplementary_retrieval_corpus,public_with_license_conditions,metadata_or_processed_outputs_when_allowed,data/README.md,"Users should follow Wikipedia license requirements when redistributing derived text."
SRC-MODEL-001,base_model,GLM-4-9B,ZhipuAI_or_model_provider,base_generation_model,external_model_license,external_download_required,configs/example_config.yaml,"The base model is not redistributed in this repository."
SRC-LORA-001,adapter_weights,MiniCarbonGPT LoRA weights,to_be_specified,domain_adaptation,to_be_verified,to_be_specified,README.md,"If redistribution is allowed, provide a release asset or external model link; otherwise provide training instructions."

